,Title,Author,Story Summary,chapter Amount
537,HoloMess,nyonoyo," My first, and still ongoing, series about girls messing their underwear. All the girls in Hololive end up soiling themselves in one way or another. Ideally I want to write stories until every girl has crapped themselves at least once. Currently, I focus on one generation at a time, but I'm thinking about doing one-offs as well to make more pairings and unique scenarios.    ",14
538,Promises,notmeromero, Ina and Ame chatting in a comfy ski lodge after skiing...or is it?    ,1
539,"""What if amesame tickle war?""",Magetro21, alina 🔎🔱 | in the void — Yesterday at 2:32 AMamesame tickle war plsZayne//Magetro21 — Yesterday at 2:32 AMOSure    ,1
540,what do I even title this with?,Magetro21, ,1
541,Lost Hope and Found You,TosamaVee," After failing to stop Omega from destroying the universe, causing the cycle of the universe to continue, IRyS finds herself recovering under the care of Hakos Baelz.    ",1
542,what do I even title this with?,Magetro21, ,1
543,Lost Hope and Found You,TosamaVee," After failing to stop Omega from destroying the universe, causing the cycle of the universe to continue, IRyS finds herself recovering under the care of Hakos Baelz.    ",1
544,A Comment From Isolation,JNES," Houshou Marine is a woman who's supposed to have it all, fame, looks, and friends, but why is she lonely on Valentines Day, the most romantic day of the year.    ",1
545,Follow the Stars,FisherSticksSix," After fleeing from the universe's core to investigate an increasingly dangerous force, Kronii finds herself in a world much more different than she could have possibly imagined. However, when she finally finds the source of the disturbance, things become complicated quickly. Not only will she need to confront a threat to the stability of the universe and hide from the council that have come looking for her, but she will also need to confront the seed of mortality that has been planted in her soul.    ",1
546,I Love You At 3AM,AphelionLies," Do you know what's the best hour of the day? It's 3am. You know what's best in that hour? You're half asleep and you like me...you talk to me, and you confessed to me. You're not shy at 3am. You're not mad at 3am. You talk to me at 3am. I get to know more about you at 3am. I get to fall in love with you again and again at 3am...I fall in love with you even deeper at 3am.    ",12
547,As Bright as the Stars,TheAncientBozo, AmeSame drought posting. Just pretend it's still Christmas.    ,1
548,One Shot HololiveEn Smuts,LaxyReed, Wah    ,2
549,One Shot HololiveEn Smuts,LaxyReed, Wah    ,2
550,Among the Myths,Meowlordfur," Using her watch's ability to its fullest potential, Amelia Watson lived a luxurious life - a nice mansion with enough staff to run a small town, enough money to buy out several small countries, and the influence to do essentially whatever she wanted.That being said, joining Hololive certainly was NOT part of her plans. What even was a Hololive anyway?! An IDOL agency? Not only that, but an agency that apparently hired weird people dressed up as cats, dogs, and dragons? None of that stuff is really real, of course... Right?Alternatively: Amelia learns that she's a small fish in a massive ocean.    ",44
551,At your earliest convenience,Oboron, Having a girlfriend makes things convenient.Having a girlfriend who could also time travel makes everything convenient.    ,1
552,Breakfast for Three,AlfaWurst," Gura's gone a week without Watson... but when Sunshine comes back home, what unfolds...?    ",1
553,Fall,Somarisu, Was inspired by the comic made by @spacemakii & @IronShiba HereArt by Yohchi HereThis is Ina's reply.    ,1
554,Report on Calliope Mori,Elleipsis," Third report that Amelia was assigned to write, this one being on Calli. Here it is.    ",1
555,We Are The Lights,ZoneTheory," ""What brings you to my lonely little table?""""I just thought… you looked cute and I wanted to get to know you.""Bae and IRyS whirlwind into love and try not to let themselves spin out of control.    ",3
556,A shark-girl piggyback the drunk detective,KagamiWatsuki, ,1
557,Open Air,rinre, There is no body of water around her to prevent her from acting on impulse. Gura just kinda goes for it.    ,1
558,Rarepair Week Ficlets,Nayarune," A loose collection of ficlets for #PolyEnRarePairWeek.Day 1: Courage/Fear (Ame/Mumei)Day 2: Stars/Emptiness (Kronii/Sana)Day 3: Sunrise/Twilight (Callie/Ollie)Day 4: Mountain/Cave (Ame/Hololive English Council (yeah, all of them))Day 5: Dream/Darkness (Ina/Gura)Day 6: Bloom/Wither (Kronii/Fauna)Day 7: Peace/Unrest (Bae/IRyS)    ",7
559,The Night is Waiting for Us,PhoebeGalaxy," Sunflower, along with her sister, ask their moms to go trick-or-treating.    ",1
560,"""But Gura!""",Magetro21, This is for you Amega :kekw: Heavily inspired by my twitter thread with Amega    ,1
561,A shark-girl piggyback the drunk detective,KagamiWatsuki, ,1
562,Just Visiting,AlfaWurst, What could possibly happen when you visit a dear ol' friend on a rainy day?    ,1
563,Some Jewels in London,pilotchiken," In a world without mystical creatures, two thieves perform a series of scams in London and this is just the beginning of a journey in the lives of some unusual people. This is a scenario where many concepts of the Holomyth are freely changed. Where the detective is the thief and the reaper is the law enforcement officer there is also the Atlantean, who is actually the detective.    ",1
564,From Another World Volume 3: More Shenanigans in Another World,Cenonn," With his memory recovered, Mikage is back to his daily life in the new world. And the ""daily life"" included participating a tournament of idol fans, getting involved in a murder case, and taking on a quest.However, Shiroe's warning about the Unkindness made Mikage want to become stronger so he can handle any attack. Luckily, Anya is not just a simple sword that helps in mana management.    ",23
565,Ina'nis Milk,CaptainCaper," While babysitting Walter, Gura accidentally tries something she doesn't care for.    ",1
566,We Are The Lights,ZoneTheory," ""What brings you to my lonely little table?""""I just thought… you looked cute and I wanted to get to know you.""Bae and IRyS whirlwind into love and try not to let themselves spin out of control.    ",3
567,A Cursed Rat,ThomasGreat," The Story of Hakos Baelz, a noblewoman, sold into a life outside of her control by her cousin.    ",3
568,Our Adventure Will Never End,Kamionii," At the end of time, Amelia Watson finds herself standing before Ouro Kronii, who is on the cusp of ending the final timeline in existence. Before fading away, one Amelia from a separate timeline has given her diary away, full of secrets regarding Kronii's perfect plan, to the final universes Myth group, hoping to ensure their survival. Hope, despair, love, lies and betrayal await!    ",9
569,Sunflowers are beautiful.,Magetro21," Gawr Gura, a passionate gardener, was approached by her neighbor that had just moved the day prior. The two talk start a conversation and clicked like a satisfying fidget toy, unbeknownst to Gura though, her neighbor was actually her childhood friend.Flowers are comforting    ",1
570,"Wet in the rain, warm in her hoodie",Magetro21, ,1
571,endless,DonLucky, amelia looks up at the sky.    ,1
572,Medical Professionals,Gl1tch3dOracle," Ina enjoys some silence with her girlfriends. After a tiny kitchen accident, Gura and Amelia unleash their full medical professional powers.    ",1
573,Story Time about past,DammerDoctor," What you will do when you dont wanna go anywhere and just stay at home? Ofcourse drink some tea and eat some sweets.But Kiara wanna know, how Ame Fall in Love with Ina, and this means, there are story time!    ",1
574,Waiting (and Rock Kickin'),Scump_Smallbrain," Gura and Ame have some time to kill. Ame sees this as an opportunity to introduce Gura to a beloved teenage pastime she calls rock kickin'.Also, Gura is in love.    ",1
575,#KiarasBalls,KingMufasa, Amelia decided to investigate a certain situation...    ,1
576,Lost in the Echo,The_Architect_Of_Light," It's Amelia's best shot at survival. So, she does the only thing she can think about in this situation: Time Jump.It was going to have a HUGE set of consequences for everyone involved... Including her close friends.    ",1
577,Zayne//Magetro21's short shots :D,Magetro21, MORE MOOOOOOOOOOOOOREMOOOOOOOOOOOOOOOOOOOOOOOOOOOOOOOOOOOOOOOOOOOOOOOOOORE    ,3
578,Watching as my heart grow fonder,RaidGachaSalt, An au if our favorite reaper had been watching over the other HoloEN before Hololive happen.    ,1
579,Heat,ZoneTheory," Being a rat girl had its advantages, cute lil’ tail, adorable ears, pointy teeth. All good things in Bae’s mind. However, going into heat every few months wasn’t something one would expect to be included in the rat girl package.    ",1
580,Knowing a Nephilim,CaptainCaper," Ninomae Ina'nis feels lonely during one movie night, and finds comfort from an unexpected source.    ",1
581,Peafowl Fantasy,Valmariel," Calamity follows a certain Royal Princess to another universe, and threatens to swallow it all.    ",1
582,Knowing a Nephilim,CaptainCaper," Ninomae Ina'nis feels lonely during one movie night, and finds comfort from an unexpected source.    ",1
583,One Last Trick... [Oneshot],Rook_385," Gura wanted to cry. But she had no more to shed. She knew this day would come, and had been coming closer, for nearly her entire life. Since the first time she had met that incredible, blonde, detective. Had the time travel extended their time together, yes, it had. However, there was always an end, that was something Amelia had told her upon their first meeting. Time will always run out in some way shape or form. Which brought her to today. Where Amelia Watson, the world's greatest detective. The human that had kept four of the most powerful mythical beings together. The Human who, no matter what, would never surrender to the endless enemies they had fought, and saved the world with that shit-eating smile on her face. Would be laid to rest.    ",1
584,I'll take anyone on just for you!,Magetro21, Amelia the dork star student and Gura the delinquent transfer studentWhat fate lies upon these two?    ,2
585,Stitches and Scars,Tripsout2 (Azureshadowmoon), Gura and the scars on her tail.    ,1
586,Where's the warden?,viaaaaaaaaaaa," Kronii's actions lead into other's curiosity, even the gods. THIS STORY IS IN FREEFORM I MIGHT HAVE SIDE STORIES, LITTLE FICLETS SUCH AS IMAGINES WITH KRONMEI AND OTHER SHIPS(≡^∇^≡) (i dont know how to write tbh)    ",4
587,Lost To The Void,LostChild911," Drabbles.Ideas without purpose or use.Unrealized Worlds that may never exist.Most important of them all, completed stories but without real endings.    ",13
588,Gura is mine!,Magetro21," OhohooooWhat if, clingy Amelia?Man I want that    ",1
589,Funny Feelings,PhoebeGalaxy," Gura’s feelings for her sunshine are too much to handle, maybe, it’s time to say it once and for all.    ",1
590,No one in the world ever gets what they want.,Crooked_Crow, She was just a Guardian. One who had seen many tragedies. One who had seen many beginnings.One who kept seeing the same person over and over and over again. - Or: Mumei swears she's seen the Myths somewhere before. Particularly one Amelia Watson.    ,1
591,Stitches and Scars,Tripsout2 (Azureshadowmoon), Gura and the scars on her tail.    ,1
592,Almost Perfect,pilotchiken," Amelia was always perfect at keeping her cool posture in front of Kiara. But their first ‘date’ can complicate things.   EN version of ""Quase Perfeito""    ",1
593,Defenseless?,Somarisu, It's been a long day for co-workers and childhood friends Amelia Watson & Ninomae Ina'nis.They decided to kick the Friday night off with a couple of drinks to celebrate the end of the week.What could possibly go wrong right?    ,3
594,Gura Bakes!,Magetro21," Basically, Gura was snooping behind Amelia and giving her a piece of her mindI'm kidding kind ofGura notices that Amelia might like buttered cookies and so decides to create her own version and give it to Amelia    ",1
595,MYTH MYSTIC YNGRAMME TACTICAL HEROINES,Pika_the_Chuu," The lid to the cauldron of hell was opened by an act of love.  As humanity races to it's oblivion, a group of young women stand in the way of total annihilation of the human race.  This is their story...    ",1
596,"Some people are artists. Some, themselves, are art.",reo_oo1, Ina paints traces of herself on soft skin.    ,1
597,The Standoff,Halcyonemertean, Gura has a standoff with Wellington for Amelia's stomach.    ,1
598,don't refocus your eyes in the darkness,helpisontheway," Watson just wanted to sleep. Apparently, her dog had other plans. They go on an adventure.    ",1
599,No more quiet life,13MON, Ina goes on a trip down memory lane and remembers how she got to this point.Thank you for reading! uwu    ,1
600,signals,mayraki," Gura almost never gets dreams but when she does, it turned into her worst nightmare    ",1
601,Her Sunshine,KeroUwU, Gura reminisces about the times she felt the sun for the first time    ,1
602,Funny Feelings,PhoebeGalaxy," Gura’s feelings for her sunshine are too much to handle, maybe, it’s time to say it once and for all.    ",1
603,Ring Fit Adventure!,PhantomKeeperQazs, Amelia found herself stuck on a strange staircase that never seemed to end. No one is around and she hears some questionable noises. Time for her to investigate!    ,1
604,The Words I Can't Say,SumDumMuffin," When Irys can't speak for the day, Bae steps in to be her voice.    ",1
605,Timely Death,RaidGachaSalt," The world slowly crumbles under the feet of the Reaper and Time Traveler, as they continue to fight for its survival.With each hit, the clock tickles down, a swing to the right, a parry to the left, a shot was fired and a sacrifice was required for the hope to see another day.    ",1
606,Mr Brightside,The_Architect_Of_Light," After a night that Amelia can't remember, her friends come to help her. Thing is... Who the hell is the guy who screwed Ame? And...Will Gura murder him?    ",6
607,Rainy Days,Tripsout2 (Azureshadowmoon), They have each other.    ,2
608,"At the end of the world, there is a shark",IronShiba (wegglebots)," The girl cleared her throat. Her voice was clear, steady. There was a playfulness to the way she read out of her notebook. There was warmth. Familiarity. You didn’t quite understand but you listened, curious.She read. “At the end of the world, there is a shark.”    ",1
609,Blankets,rinre," Two girls and the feeling of falling in love. Under blankets, everything goes.    ",1
610,signals,mayraki," Gura almost never gets dreams but when she does, it turned into her worst nightmare    ",1
611,Her Sunshine,KeroUwU, Gura reminisces about the times she felt the sun for the first time    ,1
612,Kiss Me,AphelionLies," ""Oh, kiss me, beneath the milky twilightLead me out on the moonlit floor""-Kiss Me by Sixpence None The Richer    ",1
613,A Short Horror About Reine's Shorts,VelvetNimbus, Reine buys a pair of shorts from Kusaland and starts to have nightmares.    ,1
614,Irys tries to fluster Bae,SumDumMuffin, Some say the best part about a tsundere signifigant other is seeing them try to bottle up their feelings and fail    ,1
615,HoloAfterLive: Friends in the Sky,wrsw," “When we are dreaming alone it is only a dream. When we are dreaming with others, it is the beginning of reality.”Tokino Sora and friends start turning their dream into reality within the heavenly realm.    ",20
616,Helping Hands,bulkbronze," No matter where Gura might be, help always seems to find her.    ",1
617,Sky / Desmoronar - The Flame and The Fall,pilotchiken," The world is near end, but one emotion still burns in Amelia's heart. O mundo está perto do fim, mas uma emoção ainda queima no coração de Amelia. ENGLISH and Portuguese versions    ",1
618,The Delinquent and The Princess,Mrn0odlez," Takanashi Kiara was suddenly surprised when her parents wanted to go overseas due to work related trip. It was her last year at her high school and has already completed her 1st semester, she was opposed that she would have to start all over making new friends which is hard for a shy orange bright haired induvial. While on the other hand there was Mori Calliope she was raised as a good child so where did it go wrong, why did she suddenly become so violent and a delinquent    ",21
619,here with me,inochiijo, Your face from that day still haunts me to this day.    ,1
620,A Reaper's Work,AsmodeusWorks," Calliope's work as a reaper may not be pleasant, but it is a necessary task.    ",1
621,And Some Chocolates for You,Meowlordfur, A series of short one shots (anywhere from 1k to 4k words) telling the story of pairs that have very few - if any - works on this site. Done for the PolyEN Rare Pair Week going from Feb 14th to the 20th!Rated M due to a single story - also worth noting that only one of these stories actually takes place on Valentine's Day!Day 1 - Courage/Fear (Fauna/Gura)Day 2 - Stars/Emptiness (Kronii/Sana)Day 3 - Sunrise/Twilight (Gura/Omegaα)Day 4 - Mountain/Cave (Kronii/Amelia) - Rated MDay 5 - Dream/Darkness (Ina/Mumei)Day 6 - Bloom/Wither (Calli/Fauna/Kiara)Day 7 - Peace/Unrest (Baelz/Amelia)Enjoy!    ,7
622,Irys tries to fluster Bae,SumDumMuffin, Some say the best part about a tsundere signifigant other is seeing them try to bottle up their feelings and fail    ,1
623,Where All Good Things Start,simpnati0n, A knight that is in need of equipment and food stumbles somewhere maybe she shouldn't be...    ,1
624,Baby Walter Goes On A Little Adventure,Trainrider," Lately lot's of super powered children of Myth have been appearing all through out the Mythverse. It's strange that they all appeared in such a sort time from each other, but that's not what we will be exploring today. Today, we will be going through an anecdote from the life of the Walter Watson of Timeline: 1892. Although, I doubt he remembers this story himself. He was only 3 after all.    ",1
625,A world without chaos,Derpydan," Basically a ""what if?"" scenario where Mumei remembers everything that Bae has done    ",20
626,this heart is burning up!,velvet_plush, Rumor has it that a true love’s kiss breaks curses. Amelia Watson requires four.    ,1
627,Bloom and Wither,yokazex (wolfegang)," Kiara made flowers grow in Calli's lungs, and although they were beautiful; She couldn't breathe.Hanahaki AU.    ",6
628,"infinity, it may be",DonLucky," ""I'll fake and cheat death as many times as you need me to.""    ",1
629,Reine and Anya celebrate Holoro 1st Anniversary,Pearl_The_Pearl, 1st Anniversary of Holoro!Reine want to celebrate Holoro already 1st Anniversary of But Ollie was gonna go after they finished the 12hrs holoro stream and the house only had anya and reine.    ,1
630,Marshall Maximizer X Love Me Love Me,Pearl_The_Pearl," Marshall Maximizer X Love Me Love Me,plz check their song is amazing!the though of this fanfic is by Retayu that MM X LMLM fanart.    ",1
631,spring in the best way possible,DonLucky," There in the middle of green and yellow, a hue of purple – gorgeous and picturesque.    ",1
632,In Loving Memory,Tripsout2 (Azureshadowmoon), Ina is alone for the day.    ,1
633,Hubris,Rook_385," Kronii has challenged Amelia to a marathon to see who was more fit! Short answer, it wasn't Kronii and her hubris for challenging Amelia was shoved in her face.    ",1
634,spring in the best way possible,DonLucky," There in the middle of green and yellow, a hue of purple – gorgeous and picturesque.    ",1
635,In Loving Memory,Tripsout2 (Azureshadowmoon), Ina is alone for the day.    ,1
636,I Found You,ReapingReaper, Gura's experience from the thousands of years she lived.    ,1
637,When She Loved Me,PhoebeGalaxy," Just a regular day in the life of Gawr Gura, or at least, the life she has since Amelia left her.    ",1
638,Rap and Dap,Alien Smithee (ComicaWritesThings)," Calliope is working on the lyrics for another one of her raps, but she isn't exactly satisfied with the results. Can the detective solve her problem for her?    ",1
639,"all bark, no bite",chronekko," With the power of an ancient god, anything is paw-sible.    ",1
640,Child of the Blade,Valmariel," A girl was born when the stars aligned, yet men's desire to corrupt the purest of souls is truly immeasurable.    ",1
641,Hubris,Rook_385," Kronii has challenged Amelia to a marathon to see who was more fit! Short answer, it wasn't Kronii and her hubris for challenging Amelia was shoved in her face.    ",1
642,Cover Corp Papers,ThalioTP," ""Wherever light can hope to reach, the dark will always be there waiting."" Outside the government, but beyond the law. Cover Corporation is an internationally based organization with the aim to act as first responder to the supernatural. Our principle is to put humanity first and foremost, but beyond that is the goal to learn and coexist with the supernatural. Until there will be a time where normalcy of change will not be met with difficulty, our work is yet to be finished.    ",11
643,personal gallery,chronekko, Ninomae Ina'nis overestimated herself. Amelia Watson just wants someone to cuddle with.    ,1
644,Hearth & Tempest,chronekko," The calm, the storm, and sunshine.    ",2
645,here with me,inochiijo, Your face from that day still haunts me to this day.    ,1
646,Cover Corp Papers,ThalioTP," ""Wherever light can hope to reach, the dark will always be there waiting."" Outside the government, but beyond the law. Cover Corporation is an internationally based organization with the aim to act as first responder to the supernatural. Our principle is to put humanity first and foremost, but beyond that is the goal to learn and coexist with the supernatural. Until there will be a time where normalcy of change will not be met with difficulty, our work is yet to be finished.    ",11
647,When She Loved Me,PhoebeGalaxy," Just a regular day in the life of Gawr Gura, or at least, the life she has since Amelia left her.    ",1
648,personal gallery,chronekko, Ninomae Ina'nis overestimated herself. Amelia Watson just wants someone to cuddle with.    ,1
649,Hearth & Tempest,chronekko," The calm, the storm, and sunshine.    ",2
650,through these glass patterns,reo_oo1, we are searching for reasons to fall in love.    ,130
651,The kid games,Agent_Souppy_soup," Amelia is on a mission to investigate an organization that makes people play deadly games to earn money. Get inside the organization, she soon knows more about this organization and no one knows will she be able to get out of there or not.    ",1
652,After Our Lives,Phemon13," Amelia and Gura find out what's waiting for them, and thankfully it's something they know...    ",1
653,Kinder egg surprise,Pika_the_Chuu, Calli's feeling under the weather leading to a visit to the underworld hospital    ,6
654,Ephemeral Flowers,Somarisu," If you asked me what I thought about longevity and immortality,Without a doubt I will call it a curse.You wouldn’t understand simply with just that,But I can tell you about me.    ",1
655,Blazing Death,StoryCorner," Calli has been summoned to Hell. To prevent new Demon Lord and his forces from leaving the Realms of Hell. And Kiara has joined her, to keep the Demon Forces at bay and making sure that both of them can leave this battle alive...A very LATE TakaMori Anniversary Fic!    ",1
656,Hic et nunc,Niyusa," You are here, I know that.I am here and I am aware of it.    ",1
657,Back To Each Other's Arms,Nesz," “I missed this.”“Missed what?”“This. Us. Just messing around, bantering, trying to one up each other.”    ",1
658,"""Goodluck Detective""",Magetro21," Stuck in a time loop, Amelia goes back to where Gura had debuted, redoes everything and goes back to the same thing that made her time travel. But each time she goes back, her memory is erased. And so, She's forever stuck in a time loop that only Gawr knows off.    ",1
659,Holohigh,SumDumMuffin, Takamori Vignettes around an AU where Hololive is a performing arts high school.    ,8
660,After Our Lives,Phemon13," Amelia and Gura find out what's waiting for them, and thankfully it's something they know...    ",1
661,Kinder egg surprise,Pika_the_Chuu, Calli's feeling under the weather leading to a visit to the underworld hospital    ,6
662,Ephemeral Flowers,Somarisu," If you asked me what I thought about longevity and immortality,Without a doubt I will call it a curse.You wouldn’t understand simply with just that,But I can tell you about me.    ",1
663,Wished you in this reality,Magetro21," Test 0601-2006 (Selachimorpha)Name: Gawr GuraStatus: AliveOut of many failed attempts, 0601-2006 was the only successful experiment from the ""Atlantic"" experimentation, designed specifically for aquatic human hybrids. Permission to perform Test 1113-2020 approved.    ",1
664,The Abyss,PhoebeGalaxy," For as long as she can remember, no matter what happened in her life or in her mind, and during every night; Amelia fell to the abyss.    ",1
